<?xml version="1.0"?>
<!DOCTYPE eInfoResult PUBLIC "-//NLM//DTD eInfoResult, 11 May 2002//EN" 
  "http://www.ncbi.nlm.nih.gov/entrez/query/DTD/eInfo_020511.dtd">

<eInfoResult>
    <DbList>
        <DbName>pubmed</DbName>
        <DbName>protein</DbName>
        <DbName>nuccore</DbName>
        <DbName>nucleotide</DbName>
        <DbName>nucgss</DbName>
        <DbName>nucest</DbName>
        <DbName>structure</DbName>
        <DbName>genome</DbName>
        <DbName>assembly</DbName>
        <DbName>gcassembly</DbName>
        <DbName>genomeprj</DbName>
        <DbName>bioproject</DbName>
        <DbName>biosample</DbName>
        <DbName>biosystems</DbName>
        <DbName>blastdbinfo</DbName>
        <DbName>books</DbName>
        <DbName>cdd</DbName>
        <DbName>clone</DbName>
        <DbName>gap</DbName>
        <DbName>gapplus</DbName>
        <DbName>dbvar</DbName>
        <DbName>epigenomics</DbName>
        <DbName>gene</DbName>
        <DbName>gds</DbName>
        <DbName>geo</DbName>
        <DbName>geoprofiles</DbName>
        <DbName>homologene</DbName>
        <DbName>journals</DbName>
        <DbName>medgen</DbName>
        <DbName>mesh</DbName>
        <DbName>ncbisearch</DbName>
        <DbName>nlmcatalog</DbName>
        <DbName>omia</DbName>
        <DbName>omim</DbName>
        <DbName>pmc</DbName>
        <DbName>popset</DbName>
        <DbName>probe</DbName>
        <DbName>proteinclusters</DbName>
        <DbName>pcassay</DbName>
        <DbName>pccompound</DbName>
        <DbName>pcsubstance</DbName>
        <DbName>pubmedhealth</DbName>
        <DbName>seqannot</DbName>
        <DbName>snp</DbName>
        <DbName>sra</DbName>
        <DbName>taxonomy</DbName>
        <DbName>toolkit</DbName>
        <DbName>toolkitall</DbName>
        <DbName>unigene</DbName>
        <DbName>unists</DbName>
        <DbName>gencoll</DbName>
    </DbList>
</eInfoResult>
